{
  "schemaVersion": "0.2.0",
  "planSha256": "fa9e766d53de457f2953205d0f44d88bb34547fb28948ba6a5047e0b4f77bb7e",
  "artifactSha256": "16e32285f4a54075e44bd58c378e8fff594572c34998ef956f2ebe99831b2964",
  "status": "pass",
  "summary": {
    "total": 21,
    "pass": 21,
    "fail": 0,
    "unknown": 0,
    "critical": 0,
    "error": 0,
    "warning": 0
  },
  "findings": [
    {
      "ruleId": "plan.valid",
      "severity": "info",
      "status": "pass",
      "location": "plan",
      "expected": "content, facts and binding agree with the support manifest",
      "observed": true,
      "classification": "non-repairable"
    },
    {
      "ruleId": "html.structure",
      "severity": "info",
      "status": "pass",
      "location": "artifact",
      "expected": "complete, balanced HTML document",
      "observed": [],
      "classification": "non-repairable"
    },
    {
      "ruleId": "html.self_contained",
      "severity": "info",
      "status": "pass",
      "location": "artifact",
      "expected": "static self-contained HTML",
      "observed": [],
      "classification": "non-repairable"
    },
    {
      "ruleId": "facts.unique",
      "severity": "info",
      "status": "pass",
      "location": "artifact",
      "expected": "7 unique fact markers",
      "observed": 7,
      "classification": "non-repairable"
    },
    {
      "ruleId": "facts.exact",
      "severity": "info",
      "status": "pass",
      "location": "artifact",
      "expected": "7 exact facts",
      "observed": 7,
      "classification": "non-repairable"
    },
    {
      "ruleId": "facts.approved_text",
      "severity": "info",
      "status": "pass",
      "location": "body",
      "expected": "all visible source text belongs to approved facts",
      "observed": [],
      "classification": "non-repairable"
    },
    {
      "ruleId": "move.semantics",
      "severity": "info",
      "status": "pass",
      "location": "title",
      "expected": "the unique title fact in a level-one heading",
      "observed": "present",
      "classification": "non-repairable"
    },
    {
      "ruleId": "move.semantics",
      "severity": "info",
      "status": "pass",
      "location": "datum.label-value",
      "expected": "label and primary value in one Datum section",
      "observed": {
        "sectionCount": 1,
        "label": true,
        "value": true,
        "sameOrderedSection": true
      },
      "classification": "non-repairable"
    },
    {
      "ruleId": "render.binding",
      "severity": "info",
      "status": "pass",
      "location": "render_evidence",
      "expected": {
        "planSha256": "fa9e766d53de457f2953205d0f44d88bb34547fb28948ba6a5047e0b4f77bb7e",
        "artifactSha256": "16e32285f4a54075e44bd58c378e8fff594572c34998ef956f2ebe99831b2964"
      },
      "observed": null,
      "classification": "renderer-or-configuration"
    },
    {
      "ruleId": "render.viewport_fit",
      "severity": "info",
      "status": "pass",
      "location": "viewport:1280x960",
      "expected": "horizontal fit, readable body and no browser/resource errors",
      "observed": {
        "clientWidth": 1280,
        "clientHeight": 960,
        "scrollWidth": 1280,
        "scrollHeight": 960
      },
      "classification": "non-repairable"
    },
    {
      "ruleId": "render.facts",
      "severity": "info",
      "status": "pass",
      "location": "viewport:1280x960",
      "expected": "7 exact, visible, unclipped and unobscured facts",
      "observed": 7,
      "classification": "non-repairable"
    },
    {
      "ruleId": "facts.approved_text",
      "severity": "info",
      "status": "pass",
      "location": "viewport:1280x960",
      "expected": "no unapproved visible text",
      "observed": [],
      "classification": "non-repairable"
    },
    {
      "ruleId": "render.semantics",
      "severity": "info",
      "status": "pass",
      "location": "viewport:1280x960",
      "expected": {
        "move": "Datum",
        "oneVisibleH1": true,
        "relationships": [
          {
            "id": "datum.label-value",
            "passed": true
          }
        ]
      },
      "observed": {
        "move": "Datum",
        "oneVisibleH1": true,
        "relationships": [
          {
            "id": "datum.label-value",
            "passed": true
          }
        ]
      },
      "classification": "non-repairable"
    },
    {
      "ruleId": "instrument.invariant_band",
      "severity": "info",
      "status": "pass",
      "location": "viewport:1280x960",
      "expected": {
        "count": 1,
        "containsTitle": true,
        "x": 0,
        "width": 1280,
        "height": 32,
        "backgroundColor": "rgb(17, 17, 17)",
        "titleColor": "rgb(255, 255, 255)",
        "borderWidths": {
          "top": 0,
          "right": 0,
          "bottom": 0,
          "left": 0
        }
      },
      "observed": {
        "count": 1,
        "containsTitle": true,
        "bounds": {
          "x": 0,
          "y": 0,
          "width": 1280,
          "height": 32
        },
        "backgroundColor": "rgb(17, 17, 17)",
        "titleColor": "rgb(255, 255, 255)",
        "borderWidths": {
          "top": 0,
          "right": 0,
          "bottom": 0,
          "left": 0
        }
      },
      "classification": "non-repairable"
    },
    {
      "ruleId": "render.screenshot",
      "severity": "info",
      "status": "pass",
      "location": "viewport:1280x960",
      "expected": "hash-matched embedded PNG with declared width and captured height",
      "observed": {
        "file": "datum-standard-1280x960.png",
        "sha256": "219d5b37fe621c3e0b6b162ce45b441a387a0863290413582b9738650a46dd3a"
      },
      "classification": "renderer-or-configuration"
    },
    {
      "ruleId": "render.viewport_fit",
      "severity": "info",
      "status": "pass",
      "location": "viewport:390x844",
      "expected": "horizontal fit, readable body and no browser/resource errors",
      "observed": {
        "clientWidth": 390,
        "clientHeight": 844,
        "scrollWidth": 390,
        "scrollHeight": 844
      },
      "classification": "non-repairable"
    },
    {
      "ruleId": "render.facts",
      "severity": "info",
      "status": "pass",
      "location": "viewport:390x844",
      "expected": "7 exact, visible, unclipped and unobscured facts",
      "observed": 7,
      "classification": "non-repairable"
    },
    {
      "ruleId": "facts.approved_text",
      "severity": "info",
      "status": "pass",
      "location": "viewport:390x844",
      "expected": "no unapproved visible text",
      "observed": [],
      "classification": "non-repairable"
    },
    {
      "ruleId": "render.semantics",
      "severity": "info",
      "status": "pass",
      "location": "viewport:390x844",
      "expected": {
        "move": "Datum",
        "oneVisibleH1": true,
        "relationships": [
          {
            "id": "datum.label-value",
            "passed": true
          }
        ]
      },
      "observed": {
        "move": "Datum",
        "oneVisibleH1": true,
        "relationships": [
          {
            "id": "datum.label-value",
            "passed": true
          }
        ]
      },
      "classification": "non-repairable"
    },
    {
      "ruleId": "instrument.invariant_band",
      "severity": "info",
      "status": "pass",
      "location": "viewport:390x844",
      "expected": {
        "count": 1,
        "containsTitle": true,
        "x": 0,
        "width": 390,
        "height": 32,
        "backgroundColor": "rgb(17, 17, 17)",
        "titleColor": "rgb(255, 255, 255)",
        "borderWidths": {
          "top": 0,
          "right": 0,
          "bottom": 0,
          "left": 0
        }
      },
      "observed": {
        "count": 1,
        "containsTitle": true,
        "bounds": {
          "x": 0,
          "y": 0,
          "width": 390,
          "height": 32
        },
        "backgroundColor": "rgb(17, 17, 17)",
        "titleColor": "rgb(255, 255, 255)",
        "borderWidths": {
          "top": 0,
          "right": 0,
          "bottom": 0,
          "left": 0
        }
      },
      "classification": "non-repairable"
    },
    {
      "ruleId": "render.screenshot",
      "severity": "info",
      "status": "pass",
      "location": "viewport:390x844",
      "expected": "hash-matched embedded PNG with declared width and captured height",
      "observed": {
        "file": "datum-standard-390x844.png",
        "sha256": "55863e79e97e050e840993c9f325309cbd63accacee74545880bd09923cf3b70"
      },
      "classification": "renderer-or-configuration"
    }
  ],
  "limitations": [
    "Supports the six Instrument HTML workflows declared by the exact support-manifest bytes.",
    "Visual quality, rhetorical effectiveness and full accessibility compliance are unassessed.",
    "Source visibility is conservative; CSS layout and clipping require current browser evidence.",
    "Render evidence is caller supplied and hash-bound, not an attestation of browser execution.",
    "Vertical document scrolling is permitted; required horizontal viewport fit is checked."
  ]
}
