{
  "schemaVersion": "0.2.0",
  "planSha256": "a4c3f9d0275ba6a711b5fbf8726419228376b8bff48b63a2e09f89d062655240",
  "artifactSha256": "59540887c7a5dc2bcfc86e8a3339ab46e8f28a288613b0a092d12623b81edb3f",
  "status": "pass",
  "summary": {
    "total": 15,
    "pass": 15,
    "fail": 0,
    "unknown": 0,
    "critical": 0,
    "error": 0,
    "warning": 0
  },
  "findings": [
    {
      "ruleId": "plan.valid",
      "severity": "info",
      "status": "pass",
      "location": "plan",
      "expected": "content, facts and binding agree with the support manifest",
      "observed": true,
      "classification": "non-repairable"
    },
    {
      "ruleId": "html.structure",
      "severity": "info",
      "status": "pass",
      "location": "artifact",
      "expected": "complete, balanced HTML document",
      "observed": [],
      "classification": "non-repairable"
    },
    {
      "ruleId": "html.self_contained",
      "severity": "info",
      "status": "pass",
      "location": "artifact",
      "expected": "static self-contained HTML",
      "observed": [],
      "classification": "non-repairable"
    },
    {
      "ruleId": "facts.unique",
      "severity": "info",
      "status": "pass",
      "location": "artifact",
      "expected": "12 unique fact markers",
      "observed": 12,
      "classification": "non-repairable"
    },
    {
      "ruleId": "facts.exact",
      "severity": "info",
      "status": "pass",
      "location": "artifact",
      "expected": "12 exact facts",
      "observed": 12,
      "classification": "non-repairable"
    },
    {
      "ruleId": "facts.approved_text",
      "severity": "info",
      "status": "pass",
      "location": "body",
      "expected": "all visible source text belongs to approved facts",
      "observed": [],
      "classification": "non-repairable"
    },
    {
      "ruleId": "move.semantics",
      "severity": "info",
      "status": "pass",
      "location": "title",
      "expected": "the unique title fact in a level-one heading",
      "observed": "present",
      "classification": "non-repairable"
    },
    {
      "ruleId": "move.semantics",
      "severity": "info",
      "status": "pass",
      "location": "bandStatement.statement",
      "expected": "the statement fact in paragraph semantics inside one Band statement section",
      "observed": {
        "sectionCount": 1,
        "present": true,
        "tag": "p"
      },
      "classification": "non-repairable"
    },
    {
      "ruleId": "render.binding",
      "severity": "info",
      "status": "pass",
      "location": "render_evidence",
      "expected": {
        "planSha256": "a4c3f9d0275ba6a711b5fbf8726419228376b8bff48b63a2e09f89d062655240",
        "artifactSha256": "59540887c7a5dc2bcfc86e8a3339ab46e8f28a288613b0a092d12623b81edb3f"
      },
      "observed": null,
      "classification": "renderer-or-configuration"
    },
    {
      "ruleId": "render.viewport_fit",
      "severity": "info",
      "status": "pass",
      "location": "viewport:320x844",
      "expected": "horizontal fit, readable body and no browser/resource errors",
      "observed": {
        "clientWidth": 320,
        "clientHeight": 844,
        "scrollWidth": 320,
        "scrollHeight": 844
      },
      "classification": "non-repairable"
    },
    {
      "ruleId": "render.facts",
      "severity": "info",
      "status": "pass",
      "location": "viewport:320x844",
      "expected": "12 exact, visible, unclipped and unobscured facts",
      "observed": 12,
      "classification": "non-repairable"
    },
    {
      "ruleId": "facts.approved_text",
      "severity": "info",
      "status": "pass",
      "location": "viewport:320x844",
      "expected": "no unapproved visible text",
      "observed": [],
      "classification": "non-repairable"
    },
    {
      "ruleId": "render.semantics",
      "severity": "info",
      "status": "pass",
      "location": "viewport:320x844",
      "expected": {
        "move": "Band statement",
        "oneVisibleH1": true,
        "relationships": [
          {
            "id": "bandStatement.statement",
            "passed": true
          }
        ]
      },
      "observed": {
        "move": "Band statement",
        "oneVisibleH1": true,
        "relationships": [
          {
            "id": "bandStatement.statement",
            "passed": true
          }
        ]
      },
      "classification": "non-repairable"
    },
    {
      "ruleId": "instrument.invariant_band",
      "severity": "info",
      "status": "pass",
      "location": "viewport:320x844",
      "expected": {
        "count": 1,
        "containsTitle": true,
        "x": 0,
        "width": 320,
        "height": 32,
        "backgroundColor": "rgb(17, 17, 17)",
        "titleColor": "rgb(255, 255, 255)",
        "borderWidths": {
          "top": 0,
          "right": 0,
          "bottom": 0,
          "left": 0
        }
      },
      "observed": {
        "count": 1,
        "containsTitle": true,
        "bounds": {
          "x": 0,
          "y": 0,
          "width": 320,
          "height": 32
        },
        "backgroundColor": "rgb(17, 17, 17)",
        "titleColor": "rgb(255, 255, 255)",
        "borderWidths": {
          "top": 0,
          "right": 0,
          "bottom": 0,
          "left": 0
        }
      },
      "classification": "non-repairable"
    },
    {
      "ruleId": "render.screenshot",
      "severity": "info",
      "status": "pass",
      "location": "viewport:320x844",
      "expected": "hash-matched embedded PNG with declared width and captured height",
      "observed": {
        "file": "band-statement-320-320x844.png",
        "sha256": "487b696e36b3600e77228512596b8e443077e026c41e8a9d3869c3a2f60c8ea5"
      },
      "classification": "renderer-or-configuration"
    }
  ],
  "limitations": [
    "Supports the nine Instrument HTML workflows declared by the exact support-manifest bytes.",
    "Visual quality, rhetorical effectiveness and full accessibility compliance are unassessed.",
    "Source visibility is conservative; CSS layout and clipping require current browser evidence.",
    "Render evidence is caller supplied and hash-bound, not an attestation of browser execution.",
    "Vertical document scrolling is permitted; required horizontal viewport fit is checked."
  ]
}
