{
  "schemaVersion": "0.2.0",
  "planSha256": "533995365517a8d46c19f69781be6ae3cdcab89c15dc1609253d82a1a61a7239",
  "artifactSha256": "7788c332683f691f3b261d964182d83b70dd777847368749890bb443d7943977",
  "status": "pass",
  "summary": {
    "total": 16,
    "pass": 16,
    "fail": 0,
    "unknown": 0,
    "critical": 0,
    "error": 0,
    "warning": 0
  },
  "findings": [
    {
      "ruleId": "plan.valid",
      "severity": "info",
      "status": "pass",
      "location": "plan",
      "expected": "content, facts and binding agree with the support manifest",
      "observed": true,
      "classification": "non-repairable"
    },
    {
      "ruleId": "html.structure",
      "severity": "info",
      "status": "pass",
      "location": "artifact",
      "expected": "complete, balanced HTML document",
      "observed": [],
      "classification": "non-repairable"
    },
    {
      "ruleId": "html.self_contained",
      "severity": "info",
      "status": "pass",
      "location": "artifact",
      "expected": "static self-contained HTML",
      "observed": [],
      "classification": "non-repairable"
    },
    {
      "ruleId": "facts.unique",
      "severity": "info",
      "status": "pass",
      "location": "artifact",
      "expected": "17 unique fact markers",
      "observed": 17,
      "classification": "non-repairable"
    },
    {
      "ruleId": "facts.exact",
      "severity": "info",
      "status": "pass",
      "location": "artifact",
      "expected": "17 exact facts",
      "observed": 17,
      "classification": "non-repairable"
    },
    {
      "ruleId": "facts.approved_text",
      "severity": "info",
      "status": "pass",
      "location": "body",
      "expected": "all visible source text belongs to approved facts",
      "observed": [],
      "classification": "non-repairable"
    },
    {
      "ruleId": "move.semantics",
      "severity": "info",
      "status": "pass",
      "location": "title",
      "expected": "the unique title fact in a level-one heading",
      "observed": "present",
      "classification": "non-repairable"
    },
    {
      "ruleId": "move.semantics",
      "severity": "info",
      "status": "pass",
      "location": "series.period-order",
      "expected": "period facts in one ordered list and in plan order",
      "observed": {
        "expected": 4,
        "observed": 4
      },
      "classification": "non-repairable"
    },
    {
      "ruleId": "move.semantics",
      "severity": "info",
      "status": "pass",
      "location": "series.value-association",
      "expected": "each visible period and display value in the same list item, with current on the last",
      "observed": true,
      "classification": "non-repairable"
    },
    {
      "ruleId": "render.binding",
      "severity": "info",
      "status": "pass",
      "location": "render_evidence",
      "expected": {
        "planSha256": "533995365517a8d46c19f69781be6ae3cdcab89c15dc1609253d82a1a61a7239",
        "artifactSha256": "7788c332683f691f3b261d964182d83b70dd777847368749890bb443d7943977"
      },
      "observed": null,
      "classification": "renderer-or-configuration"
    },
    {
      "ruleId": "render.viewport_fit",
      "severity": "info",
      "status": "pass",
      "location": "viewport:320x844",
      "expected": "horizontal fit, readable body and no browser/resource errors",
      "observed": {
        "clientWidth": 320,
        "clientHeight": 844,
        "scrollWidth": 320,
        "scrollHeight": 844
      },
      "classification": "non-repairable"
    },
    {
      "ruleId": "render.facts",
      "severity": "info",
      "status": "pass",
      "location": "viewport:320x844",
      "expected": "17 exact, visible, unclipped and unobscured facts",
      "observed": 17,
      "classification": "non-repairable"
    },
    {
      "ruleId": "facts.approved_text",
      "severity": "info",
      "status": "pass",
      "location": "viewport:320x844",
      "expected": "no unapproved visible text",
      "observed": [],
      "classification": "non-repairable"
    },
    {
      "ruleId": "render.semantics",
      "severity": "info",
      "status": "pass",
      "location": "viewport:320x844",
      "expected": {
        "move": "Series",
        "oneVisibleH1": true,
        "relationships": [
          {
            "id": "series.period-order",
            "passed": true
          },
          {
            "id": "series.value-association",
            "passed": true
          }
        ]
      },
      "observed": {
        "move": "Series",
        "oneVisibleH1": true,
        "relationships": [
          {
            "id": "series.period-order",
            "passed": true
          },
          {
            "id": "series.value-association",
            "passed": true
          }
        ]
      },
      "classification": "non-repairable"
    },
    {
      "ruleId": "instrument.invariant_band",
      "severity": "info",
      "status": "pass",
      "location": "viewport:320x844",
      "expected": {
        "count": 1,
        "containsTitle": true,
        "x": 0,
        "width": 320,
        "height": 32,
        "backgroundColor": "rgb(17, 17, 17)",
        "titleColor": "rgb(255, 255, 255)",
        "borderWidths": {
          "top": 0,
          "right": 0,
          "bottom": 0,
          "left": 0
        }
      },
      "observed": {
        "count": 1,
        "containsTitle": true,
        "bounds": {
          "x": 0,
          "y": 0,
          "width": 320,
          "height": 32
        },
        "backgroundColor": "rgb(17, 17, 17)",
        "titleColor": "rgb(255, 255, 255)",
        "borderWidths": {
          "top": 0,
          "right": 0,
          "bottom": 0,
          "left": 0
        }
      },
      "classification": "non-repairable"
    },
    {
      "ruleId": "render.screenshot",
      "severity": "info",
      "status": "pass",
      "location": "viewport:320x844",
      "expected": "hash-matched embedded PNG with declared width and captured height",
      "observed": {
        "file": "series-320-320x844.png",
        "sha256": "51f0ea1af1667ed205b297fd15de60781775d82111760f2fa967781fa64cc478"
      },
      "classification": "renderer-or-configuration"
    }
  ],
  "limitations": [
    "Supports the nine Instrument HTML workflows declared by the exact support-manifest bytes.",
    "Visual quality, rhetorical effectiveness and full accessibility compliance are unassessed.",
    "Source visibility is conservative; CSS layout and clipping require current browser evidence.",
    "Render evidence is caller supplied and hash-bound, not an attestation of browser execution.",
    "Vertical document scrolling is permitted; required horizontal viewport fit is checked."
  ]
}
