{
  "schemaVersion": "0.2.0",
  "planSha256": "acb1ad5dc4349dc115947b6318812f188334b7bfb9d694617633734fe3560371",
  "artifactSha256": "071154e0778b0d5b38f56996d173260b1feca523ff82bb0faa2248fd9b8bd04c",
  "status": "pass",
  "summary": {
    "total": 17,
    "pass": 17,
    "fail": 0,
    "unknown": 0,
    "critical": 0,
    "error": 0,
    "warning": 0
  },
  "findings": [
    {
      "ruleId": "plan.valid",
      "severity": "info",
      "status": "pass",
      "location": "plan",
      "expected": "content, facts and binding agree with the support manifest",
      "observed": true,
      "classification": "non-repairable"
    },
    {
      "ruleId": "html.structure",
      "severity": "info",
      "status": "pass",
      "location": "artifact",
      "expected": "complete, balanced HTML document",
      "observed": [],
      "classification": "non-repairable"
    },
    {
      "ruleId": "html.self_contained",
      "severity": "info",
      "status": "pass",
      "location": "artifact",
      "expected": "static self-contained HTML",
      "observed": [],
      "classification": "non-repairable"
    },
    {
      "ruleId": "facts.unique",
      "severity": "info",
      "status": "pass",
      "location": "artifact",
      "expected": "22 unique fact markers",
      "observed": 22,
      "classification": "non-repairable"
    },
    {
      "ruleId": "facts.exact",
      "severity": "info",
      "status": "pass",
      "location": "artifact",
      "expected": "22 exact facts",
      "observed": 22,
      "classification": "non-repairable"
    },
    {
      "ruleId": "facts.approved_text",
      "severity": "info",
      "status": "pass",
      "location": "body",
      "expected": "all visible source text belongs to approved facts",
      "observed": [],
      "classification": "non-repairable"
    },
    {
      "ruleId": "move.semantics",
      "severity": "info",
      "status": "pass",
      "location": "title",
      "expected": "the unique title fact in a level-one heading",
      "observed": "present",
      "classification": "non-repairable"
    },
    {
      "ruleId": "move.semantics",
      "severity": "info",
      "status": "pass",
      "location": "matrix.column-headers",
      "expected": "one visible Matrix table with ordered scope=col fact headers",
      "observed": {
        "tableCount": 1,
        "headerCount": 5
      },
      "classification": "non-repairable"
    },
    {
      "ruleId": "move.semantics",
      "severity": "info",
      "status": "pass",
      "location": "matrix.row-headers",
      "expected": "one scope=row fact header per Matrix row",
      "observed": {
        "expected": 3,
        "observed": 3
      },
      "classification": "non-repairable"
    },
    {
      "ruleId": "move.semantics",
      "severity": "info",
      "status": "pass",
      "location": "matrix.grid",
      "expected": "every Matrix value in its declared row and column grid",
      "observed": {
        "rows": 3,
        "columns": 4
      },
      "classification": "non-repairable"
    },
    {
      "ruleId": "render.binding",
      "severity": "info",
      "status": "pass",
      "location": "render_evidence",
      "expected": {
        "planSha256": "acb1ad5dc4349dc115947b6318812f188334b7bfb9d694617633734fe3560371",
        "artifactSha256": "071154e0778b0d5b38f56996d173260b1feca523ff82bb0faa2248fd9b8bd04c"
      },
      "observed": null,
      "classification": "renderer-or-configuration"
    },
    {
      "ruleId": "render.viewport_fit",
      "severity": "info",
      "status": "pass",
      "location": "viewport:320x844",
      "expected": "horizontal fit, readable body and no browser/resource errors",
      "observed": {
        "clientWidth": 320,
        "clientHeight": 844,
        "scrollWidth": 320,
        "scrollHeight": 844
      },
      "classification": "non-repairable"
    },
    {
      "ruleId": "render.facts",
      "severity": "info",
      "status": "pass",
      "location": "viewport:320x844",
      "expected": "22 exact, visible, unclipped and unobscured facts",
      "observed": 22,
      "classification": "non-repairable"
    },
    {
      "ruleId": "facts.approved_text",
      "severity": "info",
      "status": "pass",
      "location": "viewport:320x844",
      "expected": "no unapproved visible text",
      "observed": [],
      "classification": "non-repairable"
    },
    {
      "ruleId": "render.semantics",
      "severity": "info",
      "status": "pass",
      "location": "viewport:320x844",
      "expected": {
        "move": "Matrix",
        "oneVisibleH1": true,
        "relationships": [
          {
            "id": "matrix.column-headers",
            "passed": true
          },
          {
            "id": "matrix.row-headers",
            "passed": true
          },
          {
            "id": "matrix.grid",
            "passed": true
          }
        ]
      },
      "observed": {
        "move": "Matrix",
        "oneVisibleH1": true,
        "relationships": [
          {
            "id": "matrix.column-headers",
            "passed": true
          },
          {
            "id": "matrix.row-headers",
            "passed": true
          },
          {
            "id": "matrix.grid",
            "passed": true
          }
        ]
      },
      "classification": "non-repairable"
    },
    {
      "ruleId": "instrument.invariant_band",
      "severity": "info",
      "status": "pass",
      "location": "viewport:320x844",
      "expected": {
        "count": 1,
        "containsTitle": true,
        "x": 0,
        "width": 320,
        "height": 32,
        "backgroundColor": "rgb(17, 17, 17)",
        "titleColor": "rgb(255, 255, 255)",
        "borderWidths": {
          "top": 0,
          "right": 0,
          "bottom": 0,
          "left": 0
        }
      },
      "observed": {
        "count": 1,
        "containsTitle": true,
        "bounds": {
          "x": 0,
          "y": 0,
          "width": 320,
          "height": 32
        },
        "backgroundColor": "rgb(17, 17, 17)",
        "titleColor": "rgb(255, 255, 255)",
        "borderWidths": {
          "top": 0,
          "right": 0,
          "bottom": 0,
          "left": 0
        }
      },
      "classification": "non-repairable"
    },
    {
      "ruleId": "render.screenshot",
      "severity": "info",
      "status": "pass",
      "location": "viewport:320x844",
      "expected": "hash-matched embedded PNG with declared width and captured height",
      "observed": {
        "file": "matrix-320-320x844.png",
        "sha256": "a69acb7b1b17502886c4b64e32febcdbae978e7baf46d535c7c52a121774a3f3"
      },
      "classification": "renderer-or-configuration"
    }
  ],
  "limitations": [
    "Supports the six Instrument HTML workflows declared by the exact support-manifest bytes.",
    "Visual quality, rhetorical effectiveness and full accessibility compliance are unassessed.",
    "Source visibility is conservative; CSS layout and clipping require current browser evidence.",
    "Render evidence is caller supplied and hash-bound, not an attestation of browser execution.",
    "Vertical document scrolling is permitted; required horizontal viewport fit is checked."
  ]
}
